{
  "context_boundary_mode": "standard",
  "packet_mode": "canonical_core_v1",
  "packet_detail_mode": "paths_only",
  "packet_detail_mode_requested": "auto",
  "packet_detail_mode_selected": "paths_only",
  "profile": "lite",
  "repo_map_enabled": true,
  "packet_total_tokens": 40,
  "model_facing_packet_tokens": 40,
  "hard_packet_token_budget": 1200,
  "selected_context_tokens": 20,
  "saved_context_tokens": 80,
  "model_facing_context_tokens": 20,
  "model_facing_evidence_tokens": 0,
  "local_manifest_tokens": 10,
  "paths_only_packet_tokens": 40,
  "evidence_snippet_packet_tokens": null,
  "full_repo_reduction_percent": 80.0,
  "policy_metadata_tokens": 0,
  "output_contract_tokens": 0,
  "budget_exceeded": false,
  "budget_exceeded_by": null,
  "over_budget_reason": null,
  "full_text_file_count": 0,
  "summary_file_count": 0,
  "manifest_file_count": 2,
  "schema_version": "pcodex.context-receipt.v1",
  "sensitivity_classification": "private_metadata"
}
